{
  "evidence_id": "ZT-VIS-002-TERRAFORM-PREFLIGHT-20260821",
  "package_id": "ZT-VIS-002",
  "action_id": "P2-VIS-001",
  "assessed_at": "2026-08-20T23:55:51Z",
  "sanitization_status": "PASS",
  "authorization": {
    "instruction": "EXPLICIT_NEXT_TASK_APPROVAL_AFTER_SCOPE_DISCLOSURE",
    "authorized_scope": [
      "CONTROL_NODE_TERRAFORM_INSTALL",
      "OPENSTACK_PROVIDER_AUTHENTICATION",
      "TERRAFORM_INIT_VALIDATE_NO_APPLY_PLAN",
      "SANITIZED_PLAN_POLICY_REVIEW"
    ],
    "terraform_apply_authorized": false,
    "ansible_deployment_authorized": false,
    "live_validator_authorized": false
  },
  "terraform_cli": {
    "version": "1.15.8",
    "source": "HASHICORP_OFFICIAL_RELEASE",
    "signature_key_fingerprint": "C874011F0AB405110D02105534365D9472D7468F",
    "signature_verification": "PASS",
    "archive_sha256_verification": "PASS",
    "installation_scope": "CONTROL_USER_LOCAL_BIN",
    "system_package_state_changed": false
  },
  "provider_lock": {
    "provider": "terraform-provider-openstack/openstack",
    "version": "3.4.0",
    "registry_lock_verification": "PASS",
    "linux_amd64_hash_added": true,
    "windows_amd64_hash_preserved": true,
    "provider_version_changed": false
  },
  "preflight": {
    "external_cloud_profile_mode": "0600",
    "external_tfvars_mode": "0600",
    "backend_initialization": "DISABLED",
    "terraform_init": "PASS",
    "terraform_validate": "PASS",
    "openstack_authentication_via_provider": "PASS",
    "terraform_plan": "PASS",
    "terraform_show_json": "PASS",
    "refresh_enabled": false,
    "state_lock_enabled": false,
    "raw_plan_storage": "EXTERNAL_CONTROL_NODE_PROTECTED_PATH",
    "raw_plan_file_mode": "0600",
    "raw_plan_transferred_to_repository": false
  },
  "plan_review": {
    "plan_sha256": "d404918cad64856d09aed8151b6478445f8d17566dd8a1a4dae76c5af5e17078",
    "prior_resource_count": 0,
    "resource_change_count": 4,
    "destructive_action_count": 0,
    "expected_changes": [
      {"resource_type": "openstack_networking_port_v2", "action": "create", "count": 1},
      {"resource_type": "openstack_compute_instance_v2", "action": "create", "count": 1},
      {"resource_type": "openstack_blockstorage_volume_v3", "action": "create", "count": 1},
      {"resource_type": "openstack_compute_volume_attach_v2", "action": "create", "count": 1}
    ],
    "policy_checks": {
      "port_security_enabled": "PASS",
      "security_group_present": "PASS",
      "config_drive_enabled": "PASS",
      "private_exposure_metadata": "PASS",
      "package_metadata": "PASS",
      "floating_ip_resource_absent": "PASS"
    },
    "policy_decision": "PASS",
    "raw_values_recorded": false
  },
  "execution_boundary": {
    "openstack_read_only_provider_calls_executed": true,
    "terraform_plan_created": true,
    "terraform_state_file_count": 0,
    "terraform_apply_executed": false,
    "ansible_playbook_executed": false,
    "image_pull_executed": false,
    "protected_openstack_target_changed": false,
    "central_monitoring_completed": false,
    "package_runtime_promoted": false,
    "maturity_assessed": false,
    "compliance_assessed": false
  },
  "decision": "NO_APPLY_PLAN_ACCEPTED_LIVE_DEPLOYMENT_STILL_NO_GO",
  "remaining_gates": [
    "VERIFY_PROXY_TRUST_MATERIAL_ON_DEPLOYED_TARGET",
    "AUTHORIZE_LIVE_DEPLOYMENT",
    "AUTHORIZE_LIVE_VALIDATOR"
  ],
  "excluded_data": [
    "cloud credentials",
    "account and project identifiers",
    "network and security-group identifiers",
    "image flavor keypair and volume identifiers",
    "addresses and host keys",
    "raw Terraform plan and JSON",
    "Terraform logs",
    "private keys certificates and administrator secrets"
  ]
}
